,Actvitiy,Code,MET,Description
1025,Winter Activities,19011,2.0,Ice fishing
1026,Winter Activities,19018,14.0,"Skating, ice dancing"
1027,Winter Activities,19020,5.5,"Skating, ice, 9 mph or less"
1028,Winter Activities,19030,7.0,"Skating, ice, general (Taylor Code 360)"
1029,Winter Activities,19040,9.0,"Skating, ice, rapidly, more than 9 mph but not competitive"
1030,Winter Activities,19045,9.0,"Skating Treadmill, 6 - 6.9 mph, 2% grade"
1031,Winter Activities,19046,10.0,"Skating Treadmill, 7 - 7.9 mph, 2% grade"
1032,Winter Activities,19047,10.5,"Skating Treadmill, 8 - 8.9 mph, 2% grade"
1033,Winter Activities,19048,11.0,"Skating Treadmill, 9 - 9.9 mph, 2% grade"
1034,Winter Activities,19050,13.8,"Skating, speed, competitive"
1035,Winter Activities,19060,7.0,"Ski jumping, climb up carrying skis"
1036,Winter Activities,19075,7.0,"Skiing, general"
1037,Winter Activities,19080,6.8,"Skiing, cross country, 2.5 mph, slow or light effort, ski walking"
1038,Winter Activities,19090,8.5,"Skiing, cross country, 4.0-4.9 mph, moderate speed and effort, general"
1039,Winter Activities,19100,11.3,"Skiing, cross country, 5.0-7.9 mph, brisk speed, vigorous effort"
1040,Winter Activities,19110,14.0,"Skiing, cross country, elite skier, >8.0-11.9 mph, racing"
1041,Winter Activities,19112,16.0,"Skiing, cross country, 12-16 mph, elite skier, racing"
1042,Winter Activities,19115,9.5,"Skiing, cross-country skiing high-intensity training"
1043,Winter Activities,19130,15.5,"Skiing, cross country, hard snow, uphill, maximum, snow mountaineering"
1044,Winter Activities,19135,13.3,"Skiing, cross-country, skating"
1045,Winter Activities,19140,13.5,"Skiing, cross-country, biathlon, skating technique"
1046,Winter Activities,19142,12.8,"Biathlon training, 5 degree incline, 8 km/h (5 mph), with/without rifle"
1047,Winter Activities,19144,12.8,"Biathlon training, 5 degree incline, 10.7 km/h (5 mph), with/without rifle"
1048,Winter Activities,19146,9.3,"Skiing, slalom"
1049,Winter Activities,19150,4.3,"Skiing, downhill, alpine or snowboarding, light effort, active time only"
1050,Winter Activities,19160,6.3,"Skiing, downhill, alpine or snowboarding, moderate effort, general, active time only"
1051,Winter Activities,19170,8.0,"Skiing, downhill, alpine or snowboarding, vigorous effort, active time only"
1052,Winter Activities,19174,7.3,"Skiing, Alpine skiing high-intensity training"
1053,Winter Activities,19180,7.0,"Sledding, tobogganing, bobsledding, luge (Taylor Code 370)"
1054,Winter Activities,19190,5.3,"Snow shoeing, moderate effort"
1055,Winter Activities,19192,10.0,"Snow shoeing, vigorous effort"
1056,Winter Activities,19200,3.8,"Snowmobiling, driving, moderate pace, flat land"
1057,Winter Activities,19201,7.5,"Snowboarding, recreational, moderate pace, mountain"
1058,Winter Activities,19202,2.0,"Snowmobiling, passenger, light"
1059,Winter Activities,19252,5.3,"Snow shoveling, by hand, moderate effort"
1060,Winter Activities,19254,7.5,"Snow shoveling, by hand, vigorous effort"
1061,Winter Activities,19260,2.5,"Snow blower, walking and pushing"
1062,Winter Activities,19300,12.5,"Skiing, roller, elite racers"
1063,Winter Activities,19305,5.5,"Rollerskiing, 10 - 12.9 km/h, no incline"
1064,Winter Activities,19310,6.8,"Rollerskiing, 13 - 16.9 km/h, no incline"
1065,Winter Activities,19315,8.3,"Rollerskiing, 17 - 19.9 km/h, no incline"
1066,Winter Activities,19320,10.5,"Rollerskiing, 20 - 23.9 km/h, no incline"
1067,Winter Activities,19325,15.0,"Rollerskiing, 24 - 27.9 km/h, no incline"
1068,Winter Activities,19330,12.5,"Rollerskiing, 10-15 km/h, 2-5 degree incline"
1069,Winter Activities,19335,14.3,"Rollerskiing, 16-22 km/h, 2-5 degree incline"
1070,Winter Activities,19340,12.3,"Rollerskiing, 6-9 km/h, 6-10 degree incline"
1071,Winter Activities,19345,16.0,"Rollerskiing, >10 km/h, 6-10 degree incline"
1072,Winter Activities,19400,9.0,"Mountaineering, downhill climbing, walking down with rope"
1073,Winter Activities,19405,10.3,"Mountaineering, downhill climbing/cross-country skiing"
1074,Religious Activities,20000,1.0,"Sitting in church, in service, attending a ceremony, sitting quietly"
1075,Religious Activities,20001,2.0,"Sitting, playing an instrument at church"
1076,Religious Activities,20005,1.8,"Sitting in church, talking or singing, attending a ceremony, sitting, active participation"
1077,Religious Activities,20010,1.5,"Sitting, reading religious materials at home"
1078,Religious Activities,20015,1.3,"Standing quietly in church, attending a ceremony"
1079,Religious Activities,20020,2.0,"Standing, singing in church, attending a ceremony, standing, active participation"
1080,Religious Activities,20025,1.3,"Kneeling in church or at home, praying"
1081,Religious Activities,20030,1.3,"Standing, talking in church"
1082,Religious Activities,20035,2.0,Walking in church
1083,Religious Activities,20036,2.0,"Walking, less than 2.0 mph, very slow"
1084,Religious Activities,20037,3.8,"Walking, 2.8 to 3.4 mph, moderate speed, not carrying anything"
1085,Religious Activities,20038,4.8,"Walking, 3.5 to 3.9 mph, brisk speed, not carrying anything"
1086,Religious Activities,20039,2.0,"Walk/stand combination for religious purposes, usher"
1087,Religious Activities,20040,5.0,"Praise with dance or run, spiritual dancing in church"
1088,Religious Activities,20045,2.3,Serving food at church
1089,Religious Activities,20046,2.0,Preparing food at church
1090,Religious Activities,20047,3.3,"Washing dishes, cleaning kitchen at church"
1091,Religious Activities,20050,1.5,Eating at church
1092,Religious Activities,20055,2.0,"Eating/talking at church or standing eating, American Indian Feast days"
1093,Religious Activities,20060,3.3,Cleaning church
1094,Religious Activities,20061,4.0,General yard work at church
1095,Religious Activities,20065,3.8,"Standing , moderate effort (e.g., lifting heavy objects, assembling at fast rate)"
1096,Religious Activities,20095,4.5,"Standing, moderate-to-heavy effort, manual labor, lifting ≥ 50 lbs, heavy maintenance"
1097,Religious Activities,20100,1.3,"Typing, electric, manual, or computer"
1098,Volunteer Activities,21000,1.3,"Sitting, meeting, general, and/or with talking involved"
1099,Volunteer Activities,21005,1.5,"Sitting, light office work, in general"
1100,Volunteer Activities,21010,2.5,"Sitting, moderate work"
1101,Volunteer Activities,21015,1.8,"Standing, light work (filing, talking, assembling)"
1102,Volunteer Activities,21016,2.0,"Sitting, child care, only active periods"
1103,Volunteer Activities,21017,3.5,"Standing, child care, only active periods"
1104,Volunteer Activities,21018,3.5,"Walk/run play with children, moderate, only active periods"
1105,Volunteer Activities,21019,5.8,"Walk/run play with children, vigorous, only active periods"
1106,Volunteer Activities,21020,3.3,"Standing, light/moderate work (e.g., pack boxes, assemble/repair, set up chairs/furniture)"
1107,Volunteer Activities,21025,3.5,"Standing, moderate (e.g., lifting 50 lbs., assembling at fast rate)"
1108,Volunteer Activities,21030,4.5,"Standing, moderate/heavy work"
1109,Volunteer Activities,21035,1.3,"Typing, electric, manual, or computer"
1110,Volunteer Activities,21040,2.3,"Walking, less than 2.0 mph, very slow"
1111,Volunteer Activities,21045,3.8,"Walking, 2.8 to 3.4 mph, moderate speed, not carrying anything"
1112,Volunteer Activities,21050,4.8,"Walking, 3.5 to 3.9 mph, brisk speed, not carrying anything"
1113,Volunteer Activities,21055,3.5,"Walking, 2.5 mph slowly and carrying objects less than 25 pounds"
1114,Volunteer Activities,21060,4.5,"Walking, 3.0 mph moderately and carrying objects less than 25 pounds, pushing something"
1115,Volunteer Activities,21065,4.5,"Walking, 3.5 mph, briskly and carrying objects less than 25 pounds"
1116,Volunteer Activities,21070,3.0,"Walk/stand combination, for volunteer purposes"
1117,Video Games,22040,1.3,"Seated, video game, handheld controller (inactive)"
1118,Video Games,22120,1.5,"Video game, handheld controller (light effort)"
1119,Video Games,22160,2.3,"Video game, light effort (Wii Fit, yoga, bowling, etc)"
1120,Video Games,22200,3.0,"Active video game, motion sensing game/using upper body (light to moderate effort)"
1121,Video Games,22240,4.0,"Active video game, motion sensing game/using total body (moderate effort)"
1122,Video Games,22280,5.0,"Active video game, motion sensing game/using total body (moderate-to-vigorous effort)"
1123,Video Games,22320,7.5,"Active video game, motion sensing game/using total body, exergames, workouts, dancing (vigorous effort)"
1124,Video Games,22360,9.8,"Conditioning/exercise virtual reality fitness, vigorous intensity"
