ug_course,ug_specialization,interests,skills,ug_score
bsc,computer applications,cloud computing,java; python; sql,85
be btech,computer science engineering,technology,analytical thinking; critical thinking; logical thinking; problem solving; programming; sql; work under pressure,66.5
ba,psychology,human behavior,communication; people management,64.6
mba,commerce,human behavior; interior design; sales and marketing; trading,accounting; critical thinking,75.525
be btech,instrumentation engineering,technology,business analysis; crossfunctional team leadership; end to end projectmanagement; labview; lean six sigma; lean six sigma blackbelt; plc allen bradley; plc ladder logic; productivity improvement; requirements gathering,70.68
be btech,computer science engineering,technology,c; html; java,73.15
bms,commerce,research; sales and marketing,analytical thinking; communication; creativity skills; critical thinking; excel; interpersonal skills; logical thinking; observation skills; presentation; problem solving; reading,73.15
be btech,computer science engineering,technology,no,74.1
be btech,computer science engineering,technology,critical thinking; java; linux; programming language skills; python; sql,69.35
bsc,physics,content writing; government job; human behavior; human biology; infrastructure; research; service; teaching; technology,active listening; artistic creative skills; communication; critical thinking; editing; gathering information; human resources; leadership; medical knowledge; problem solving; teaching; writing,86.45
bcom,accounting and finance,financial analysis,accounting; analytical thinking; cost accounting; excel; problem solving; tableau; team work; writing,63.745
be btech,automobile engineering,entrepreneurship; technology,analytical thinking; communication; gathering informing; presentation; problem solving; team work,71.44
mba,marketing,agriculture; construction management; digital marketing; human behavior; market research; sales and marketing; services; trading,accounting; business knowledge; leadership; problem solving; wealth management,59
be btech,automation engineering,data analytics,communication; critical thinking; gathering information; presentation; python; sql,69.35
bca,computer applications,technology,c; cloud computing; communication; java; python; sql; writing,71.2
be btech,science,data analytics; government job; research; technology,analytical thinking; data visualization; machine learning; python; sql,69.35
be btech,computer science engineering,data analytics; data science; financial analysis; research,artificial intelligence; communication; critical thinking; gathering information; java; leadership; machine learning; matlab; programming language skills; python; sql,64.6
be btech,mechanical engineering,entrepreneurship,analytical thinking; cost accounting; critical thinking; excel; gathering informing; leadership; logical thinking; market research; problem solving; product knowledge; programming; python; r; sql; tableau; team work; writing,71.25
be btech,electrical and electronics engineering,technology,arduino; arm cortex m; avr; c; eagle pcb; embedded c; kicad; matlab; project management,81.7
be btech,structural engineering,data analytics; research; teaching; technology,active listening; analytical thinking; communication; critical thinking; designing skills; etabs; leadership; people management; problem solving; proeficiency in software like staad pro,74.33
mtech,mining engineering,industry; teaching; technology,hardware,92
be btech,computer science engineering,data analytics; financial analysis; research; sales and marketing; technology,analytical thinking; business knowledge; cloud computing; designing skills; human resources; machine learning; problem solving; product knowledge; python; risk management skills; sql,61.75
be btech,mechanical engineering,data science; industry; information technology; technology,cad cae autocad catia ansys proe seimensnx; etabs; proeficiency in software like staad pro,73.15
bcom,accounting and finance,data analytics; digital marketing; financial analysis; gaming; government job; human behavior; human biology; journalism; research; sales and marketing; social justice; supply chain; teaching; technology; trading,accounting; active listening; analytical thinking; business knowledge; communication; critical thinking; data visualization; finance related skills; gathering information; interpersonal skills; leadership; mass communication; negotiation; people management; problem solving; product knowledge; risk management skills; sales; wealth management,80
bca,programming,service; technology,c; communication; machine learning; programming language skills; r; sales; writing,76.95
bca,programming,teaching,active listening; teaching,69
be btech,civil engineering,market research,business knowledge; civil criminal law; product knowledge,74.955
be btech,mechanical engineering,design,critical thinking; designing skills; interpersonal skills; problem solving; python,73.15
bba,management,financial analysis,financial analysis; financial modeling; financial services; marketing strategy; strategic planning,73.625
be btech,automobile engineering,entrepreneurship; financial analysis; sales and marketing; technology,business knowledge; communication; design and analysis of automobile components; design for manufacturer and assemble; designing skills; interpersonal skills; leadership; market research; people management; presentation; sales; team work; vehicle maintenance and reconditioning; work under pressure,84.55
be btech,electronics and communication engineering,embedded systems,creativity skills; designing skills; embedded systems; excel; iot; logical thinking; observation skills; risk managing; simulation; vlsi design,81.795
be btech,computer science engineering,research,analytical thinking; c; communication; creativity skills; critical thinking; excel; interpersonal skills; java; logical thinking; negotiation; presentation; programming; python; sql,75.05
be btech,electronics and communication engineering,technology,no,66.5
bcom,marketing,sales and marketing,active listening; business knowledge; communication; interpersonal skills; leadership; negotiation; problem solving; product knowledge; sales,55
bcom,economics,sales and marketing,business knowledge,85
be btech,computer science engineering,software development,no,76
be btech,computer science engineering,data analytics; financial analysis; technology; trading,analytical thinking; business knowledge; data visualization; machine learning; negotiation; problem solving; sql,76.475
be btech,mechanical engineering,trading,active listening; business knowledge; communication; risk management skills; sales,63
be btech,computer science,financial analysis; social causes; technology; web design; web development,accounting; analytical thinking; business knowledge; c; communication; critical thinking; finance related skills; problem solving; programming language skills; python; sql,87.59
pharmacy,pharmacy,research,active listening; creativity skills; logical thinking; team work,72
bcom,commerce,financial analysis,accounting; cost accounting,51.3
bsc,design,interior design,architecture; designing skills; leadership; mass communication; people management; programming language skills; writing,74
bcom,commerce,entrepreneurship,business knowledge; product knowledge; sales; team work,57
be btech,information technology,entrepreneurship,communication; gathering informing; interpersonal skills; leadership; mass communication; observation skills; people management; risk managing; team work; work under pressure,65.55
bsc,chemistry,government job,sports,74.1
bca,computer applications,technology,artificial intelligence; java; machine learning; python; sql; tableau,76
be btech,automobile engineering,entrepreneurship; human behavior; research,analytical thinking; critical thinking; designing skills; excel; observation skills; product knowledge; reading; reporting; risk managing; team work,76
be btech,electrical and electronics engineering,blockchain; information technology,aks; apache; aws; aws ec2; bash; continuous integration and continuous delivery ci cd; docker; internet information services iis; jenkins; kubernetes; new relic apm; terraform,74.67
be btech,computer science engineering,software development,full stack development; java; python; react,74.1
be btech,mechanical engineering,data science; excel; machine learning; supply chain,active listening; analytical thinking; machine learning; negotiation; problem solving; product knowledge; python; risk management skills,88.35
be btech,computer science engineering,software development,android development; codeigniter; graphic design; java development; web development,73.15
be btech,mechanical engineering,data analytics; data science; government job; trading,data visualization; python; sql,78.185
bcom,commerce,financial analysis,accounting; active listening; artistic creative skills; business knowledge; communication; critical thinking; gathering information; social media marketing,63
bsc,physics,technology,accounting; active listening; artificial intelligence; creativity skills; critical thinking; excel; logical thinking; observation skills; presentation; problem solving; product knowledge; programming; python; reading; risk managing; team work,68.685
be btech,mechanical engineering,industry; technology,cad cae autocad catia ansys proe seimensnx,74.1
mtech,electronics and communication engineering,content writing; data analytics; data science; design; digital marketing; excel; gardening; information technology; machine learning; market research; research; sales and marketing; service; social media marketing; teaching; technology; web design; web development,analytical thinking; architecture; artificial intelligence; aws; c; communication; designing skills; editing; javascript; leadership; machine learning; matlab; php; problem solving; programming language skills; python; r; sales; social media marketing; sql; teaching; writing,87
bsc,statistics,data analytics,analytical thinking; critical thinking; leadership; machine learning; problem solving; python,69.35
be btech,computer science engineering,information technology,java; problem solving; programming; python; sql,69
bsc,information technalogy,research; technology,active listening; analytical thinking; artificial intelligence; c; creativity skills; editing; machine learning; mass communication; problem solving; python; team work,89.87
bcom,commerce,blockchain,artistic creative skills,60
be btech,industrial engineering,data analytics; data science; financial analysis; gardening; human behavior; human biology; research; trading,analytical thinking; business knowledge; civil criminal law; communication; critical thinking; data visualization; finance related skills; gathering information; interpersonal skills; leadership; machine learning; negotiation; people management; problem solving; product knowledge; python; risk management skills; sql,72
be btech,mechanical engineering,supply chain; technology,business knowledge; negotiation; product knowledge; sales,60.8
diploma,manufacturing engineering,technology,designing skills,70
bcom,accounting and finance,financial analysis,company law; company secretarial work; corporate law; corporate social responsibility; due diligence; industrial and labour law; public company compliance; regulatory compliance; statutory compliances,83.03
be btech,computer science engineering,data analytics; design; research; technology,active listening; client management; communication; programming language skills,68.02
be btech,computer science engineering,teaching; technology; web design,active listening; content creation; gathering information; mass communication; programming language skills,68.4
be btech,information technology,human behavior; human biology; technology,analytical thinking; gathering informing; risk managing; sql,76
bsc,computer science,data analytics; data science; technology,analytical thinking; data visualization; python; sql,66.5
bsc,computer science,digital marketing; market research,analytical thinking; business knowledge; communication; data visualization; designing skills; excel; hospitality; human resources; leadership; people management; presentation; problem solving; product knowledge; risk management skills; sql; writing,75
be btech,mathematics,teaching; technology,analytical thinking; c; logical thinking; writing,71.25
bca,computer applications,technology,active listening; negotiation,71.25
be btech,information technology,technology,java; programming; sql,76
be btech,electrical and electronics engineering,software development,full stack development,78.85
be btech,electrical and electronics engineering,data science; machine learning; sports industry,analytical thinking; business knowledge; communication; programming language skills; python; sql,73.53
be btech,computer science engineering,data science; machine learning,artificial intelligence; c; data visualization; java; linux; machine learning; programming language skills; python; r; sql,73.625
bcom,accounting business and management,digital marketing; financial analysis; research; sales and marketing,artificial intelligence; business knowledge; communication; critical thinking; negotiation,85.69
mba,marketing,sales and marketing,business knowledge; communication; people management; product knowledge; sales; social media marketing,72
be btech,civil engineering,product lifecycle management,agile methodologies; business development; c; digital marketing; metrics; microsoft officebentley inroadsproduct requirements; product innovation; product management; research; usability testing; user experience ux; user stories,72.675
be btech,electrical and electronics engineering,technology,industrial control; inverters; matlab; plc; power electronics; simulink; switchgear; variable frequency drives,79.8
bsc,computer science,data analytics; technology,c; communication; editing; people management; programming language skills; sql,78
be btech,computer science engineering,web development,active listening; critical thinking; gathering information; hardware; programming language skills,71
be btech,computer science engineering,supply chain; technology,analytical thinking; artificial intelligence; machine learning; python; sql,85
be btech,civil engineering,construction; construction management; data analytics; data science; financial analysis; interior design; project management,communication; construction management; gathering information; javascript; people management; problem solving; python; sales,68.495
law hons,statistics,human behavior,active listening; civil criminal law; machine learning; negotiation; people management,61.4
be btech,law,entrepreneurship; research; sales and marketing; technology,analytical thinking; logical thinking; product knowledge; team work,68.4
be btech,mechanical engineering,government job; research; supply chain; technology,active listening; artistic creative skills; client management; communication; critical thinking; editing; gathering information; hardware; hospitality; human resources; leadership; mass communication; negotiation; people management; presentation; problem solving; product knowledge; risk management skills; social media marketing; writing,72.675
be btech,electrical and electronics engineering,research; teaching; technology; trading,accounting; active listening; communication; problem solving; product knowledge,52
be btech,electrical and electronics engineering,data science; human behavior; human biology; industry; market research; research; social media marketing; teaching; technology; trading,analytical thinking; critical thinking; matlab; medical knowledge; problem solving; programming language skills; python; teaching,62.26
be btech,mechanical engineering,market research; project management; sap mm,analytical thinking; business knowledge; finance related skills; presentation; problem solving; risk management skills,80.75
be btech,electrical and electronics engineering,data analytics,analytical thinking; artificial intelligence; data visualization; machine learning; python; r; social media marketing,63.9
be btech,mechanical engineering,content writing; social media marketing; trading; web design; web development,c; hadoop; informatica; java; javascript; sql,80.37
bcom,computer science engineering,financial analysis,accounting,91.2
be btech,accounting and finance,entrepreneurship,active listening; gathering informing; programming; python,88.35
law hons,agriculture,agriculture; excel; financial analysis; information technology; services; social causes,accounting; civil criminal law; finance related skills; negotiation; risk management skills,67
be btech,law,data analytics,javascript; python,73.15
bsc,electrical and electronics engineering,research,subject knowledge,52.25
be btech,physics,data analytics,javascript,65.55
be btech,computer science engineering,technology,python,70.3
be btech,computer applications,information technology; technology,cloud computing; communication; hardware; java; linux; presentation; problem solving; programming language skills; python; risk management skills; writing,71.25
bcom,computer science engineering,financial analysis,communication; companies act; company secretarial work; indirect taxation; interpersonal skills; legal compliance; presentation; team leadership; teamwork; time management,67.45
be btech,accounting and finance,data analytics; data science; design; government job; machine learning; navy defence related; oil and gas; teaching; technology,accounting; active listening; analytical thinking; communication; critical thinking; people management; problem solving; python; teaching,80.275
bba,electrical engineering,financial analysis,financial analysis; financial modeling,84.55
be btech,finance,biotechnology; human biology; research,bioprocess; cell culture; katte virus; microbiology; molecular biology,83.22
be btech,biotechnology,data analytics,analytical thinking; communication; excel; interpersonal skills; leadership; oracle; problem solving; reporting; sql; work under pressure,88.16
bcom,automobile engineering,information technology,cloud computing,47
bcom,accounting and finance,sales and marketing,accounting,76
be btech,data structures and algorithms,technology,gathering informing,73.15
biotechnology,biotechnology,entrepreneurship; human biology; research; technology,active listening; analytical thinking; critical thinking; negotiation; observation skills; presentation; problem solving; subject knowledge; writing,87
bcom,commerce,entrepreneurship,accounting; cost accounting; excel; writing,67.45
bcom,commerce,entrepreneurship,accounting,77
bms,management,sales and marketing,business knowledge; communication; creativity skills; excel; leadership; market research; negotiation; reading; sales; work under pressure; writing,0
be btech,computer science engineering,machine learning,c; css; design and prototype in adobe xd; html; java backend development; javascript for web developers; jdbc; object oriented programming; problem solving; responsive web design; string stringbuffer and stringbuilder in java,84.55
ballb,law,social causes; social justice,civil criminal law,74.1
bsc,zoology,data analytics; data science; human biology,artistic creative skills; data visualization; leadership; machine learning; problem solving; programming language skills; python; r; social media marketing,72
be btech,mechanical engineering,content writing; data analytics; supply chain,accounting; active listening; content creation; gathering information; programming language skills; wealth management,53
bsc,computer science engineering,human behavior; human biology,active listening; creativity skills; critical thinking; designing skills; editing; excel; leadership; logical thinking; problem solving; sql; team work,83
be btech,electronics and communication engineering,data analytics,data visualization; matlab; python; r; sql,80
law hons,law,social justice,civil criminal law,73
be btech,civil engineering,construction; construction management,etabs; proeficiency in software like staad pro,83.41
bca,programming,data analytics; information technology; web design; web development,active listening; artistic creative skills; c; communication; gathering information; leadership; problem solving; programming language skills; writing,85.5
mca,computer science,data analytics; data science; research; technology; web development,active listening; c; gathering information; java; programming language skills,69
bsc,microbiology,human biology; technology,designing skills; leadership; observation skills; presentation; team work; writing,83.6
be btech,electrical and electronics engineering,entrepreneurship; sales and marketing; teaching,leadership; machine learning; sql; tableau; writing,60.8
bsc,computer science engineering,data analytics; technology,active listening; communication; machine learning; programming language skills; python,67
bcom,taxation,financial analysis; human behavior; journalism; social justice; teaching; technology; trading,accounting; business knowledge; civil criminal law; communication; critical thinking; data visualization; finance related skills; hardware; leadership; machine learning; mass communication; problem solving; python; risk management skills; sales; sql,55
bcom,taxation,data science; financial analysis; government job; journalism; social causes; social justice; teaching; technology; trading,accounting; business knowledge; civil criminal law; communication; critical thinking; data visualization; finance related skills; hardware; leadership; machine learning; problem solving; python; sql; teaching,55
bsc,biotechnology,human behavior; research; trading,analytical thinking; artificial intelligence; artistic skills; critical thinking; logical thinking; machine learning; presentation; python; team work; work under pressure,70
be btech,business administration,entrepreneurship; financial analysis; research; sales and marketing; trading,active listening; leadership; market research; mass communication; reading; sales; team work; writing,68.4
bcom,taxation,sales and marketing,sales,60
bba,commerce,construction; construction management; financial analysis; journalism; sales and marketing; social causes,communication; finance related skills; leadership; people management; sales; social media marketing,67
be btech,mechanical engineering,data analytics; data science; design; financial analysis; industry; market research; product lifecycle management; research; sales and marketing; sap mm; service; supply chain; technology; trading,active listening; artistic creative skills; aws; business knowledge; communication; critical thinking; gathering information; hardware; people management; problem solving; product knowledge; risk management skills,63.08
be btech,electronics and telecommunication engineering,financial analysis,analytical thinking; c; cloud computing; java; linux; programming language skills; sql,66.5
be btech,civil engineering,data science; design; research,analytical thinking; communication; etabs; proeficiency in software like staad pro; python; teaching,78.28
diploma,electrical and electronics engineering,industry,active listening,62.985
be btech,electronics and communication engineering,data analytics; data science; trading,active listening; cloud computing; leadership; people management,59
ba,history,information technology; salesforce; sports industry,designing skills; hardware; leadership,64
be btech,computer science engineering,data science; web design,active listening; cloud computing; communication; critical thinking; java; programming language skills,66.5
be btech,mechanical engineering,human biology; teaching; technology,active listening; analytical thinking; gathering information; interpersonal skills; leadership; machine learning; medical knowledge,66.88
be btech,electrical and electronics engineering,software development,analytical thinking; artificial intelligence; c; machine learning; programming; python; sql,66.5
be btech,civil engineering,design; teaching,civil criminal law; finance related skills; gathering information,66
be btech,electronics and communication engineering,teaching,active listening; presentation; reading; team work; work under pressure,65.55
be btech,computer science engineering,data science; machine learning; social causes; web development,ajax; angular; bootstrap; codeigniter; javascript; jira; jquery; loopback; node js; php; trello,72.2
bms,business administration,entrepreneurship; sales and marketing,business knowledge; communication; logical thinking; people management; problem solving; reading; sales,61.56
bsc,mathematics,government job,teaching,60
bsc,biotechnology,human behavior; research; sales and marketing; teaching; trading,active listening; business knowledge; client management; communication; critical thinking; hospitality; leadership; people management; problem solving; risk management skills; writing,61.75
pharmacy,hospitality,hospitality,accounting; business knowledge; designing skills; editing; excel; sales,84.55
bsc,physics,content writing; government job; journalism; social justice,accounting; analytical thinking; artistic creative skills; critical thinking; gathering information,67
be btech,biotechnology,biotechnology; human biology; research,life sciences; molecular biology; molecular biology protein purification; polymerase chain reaction pcr; protein assays; protein characterization; protein chemistry; protein chromatography; protein electrophoresis; protein engineering; protein kinases; protein structure; protein structure prediction; western blotting,70.015
be btech,artificial intelligence,data analytics,machine learning; programming language skills; python,76
bsc,information technology,technology,active listening; critical thinking,70
