ug_course,ug_specialization,interests,skills,ug_score
bcom,marketing,digital marketing; government job; human behavior; journalism; research; social justice; technology,active listening; artistic creative skills; communication; gathering information; medical knowledge; negotiation,58
be btech,electrical and electronics engineering,data science; technology; trading,active listening; critical thinking; hardware; mass communication; programming language skills,67
be btech,electrical and electronics engineering,government job; infrastructure; social causes; technology; trading,analytical thinking; business knowledge; critical thinking; risk management skills,63
be btech,electronics and communication engineering,data analytics; financial analysis; technology,analytical thinking; data visualization; machine learning; python; sql,80
be btech,electronics and communication engineering,data analytics; financial analysis; technology,active listening; analytical thinking; artificial intelligence; business knowledge; communication; critical thinking; data visualization; machine learning; programming language skills; python; sql,80
bsc,computer science engineering,entrepreneurship; human behavior; sales and marketing; technology,c; java; logical thinking; oracle; programming; python; sales; sql; writing,71
be btech,electronics and communication engineering,entrepreneurship; research; technology,business knowledge; communication; designing skills; editing; interpersonal skills; leadership; logical thinking; mass communication; negotiation; presentation; problem solving; product knowledge; subject knowledge; team work; work under pressure; writing,81.13
be btech,electrical and electronics engineering,software development,no,73.15
be btech,automobile engineering,entrepreneurship,business knowledge; sales,65.55
be btech,computer science engineering,technology,communication; java; programming language skills; sql,64
be btech,electronics and communication engineering,content writing; data analytics; data science; gaming; gardening; market research; research; social justice; teaching; technology; web design,active listening; analytical thinking; artistic creative skills; business knowledge; c; communication; critical thinking; data visualization; designing skills; editing; gathering information; hospitality; human resources; java; leadership; machine learning; mass communication; matlab; negotiation; people management; presentation; problem solving; programming language skills; python; risk management skills; sql; writing,75
be btech,electronics and telecommunication engineering,data analytics; financial analysis,analytical thinking; artificial intelligence; communication; critical thinking; data visualization; designing skills; finance related skills; interpersonal skills; leadership; negotiation; presentation; problem solving; programming language skills; python; teaching,67
be btech,electrical and electronics engineering,technology,building rapport; excel; reading; reporting; sql; subject knowledge; writing,86.45
be btech,mechanical engineering,technology,analytical thinking; designing skills; leadership; product knowledge; python,71.98
mtech,computer science engineering,data analytics; data science; technology,analytical thinking; cloud computing; critical thinking; machine learning; programming language skills; python; sql,76.95
be btech,computer science engineering,data analytics; technology,analytical thinking; machine learning; programming language skills; python,79
be btech,electrical and electronics engineering,data analytics; gaming; human behavior; social justice; technology,analytical thinking; artificial intelligence; c; cloud computing; communication; critical thinking; data visualization; machine learning; matlab; programming language skills; python; r; sql; writing,83.695
ballb,law,legal services,civil criminal law,67.64
be btech,mechanical engineering,data analytics; data science; oil and gas; technology,excel; machine learning; product knowledge; programming language skills; python; risk management skills,64.81
be btech,mechanical engineering,research; technology,cad cae autocad catia ansys proe seimensnx,85.025
be btech,mechanical engineering,technology,no,76
be btech,chemical engineering,industry,problem solving; process safety management,78.85
be btech,accounting and finance,financial analysis; financial law,accounting; accounts receivable; back reconciliation; budgeting; business analysis; business development; business management; business planning; business strategy; consulting; corporate finance; financial analysis; financial forecasting; financial metrics; financial modeling; financial planning; financial reporting; financial structuring; forecasting; management; managerial finance; marketing; strategic planning; team management; teamwork,66.5
bba,marketing,entrepreneurship; sales and marketing; trading,active listening; business knowledge; critical thinking; gathering informing; leadership; team work,75.05
journalism,political science,content writing; government job; journalism; research,artistic creative skills; communication; editing; mass communication; people management; writing,58.5
bba,accounting and finance,financial analysis,accounting; analytical thinking; business knowledge; cost accounting; gathering informing; python; sales,87.21
be btech,automobile engineering,entrepreneurship; journalism; research; sales and marketing,active listening; analytical thinking; business knowledge; communication; cost accounting; critical thinking; gathering informing; leadership; negotiation; news gathering; observation skills; people management; product knowledge; risk managing; wealth management; work under pressure,76
be btech,automobile engineering,technology,team work,79.8
bca,computer applications,entrepreneurship; human behavior; human biology; technology,building rapport; creativity skills; critical thinking; editing; gathering informing; interpersonal skills; java; team work,66
bsc,agriculture,research; teaching,excel; presentation; python; subject knowledge; writing,86
be btech,mechanical engineering,design; industry,cad cae autocad catia ansys proe seimensnx,86.45
barch,architecture,architecture and construction; human behavior; research; sales and marketing,active listening; architecture and construction; artificial intelligence; business knowledge; communication; critical thinking; designing skills; gathering informing; leadership; negotiation; news gathering; people management; product knowledge; work under pressure,71.25
bsc,mathematics,financial analysis; research; supply chain; technology,analytical thinking; artificial intelligence; critical thinking; data visualization; machine learning; python,76
bsc,mathematics,financial analysis; technology,analytical thinking; artificial intelligence; machine learning; python; tableau,80
bsc,mathematics,data analytics; teaching,analytical thinking; artificial intelligence; programming language skills; sql,60
be btech,mechanical engineering,technology,ccna; cost accounting; creativity skills; editing; excel; leadership; linux; market research; oracle; sql; team work; work under pressure,72.2
ba,political science,financial analysis; sales and marketing; trading,accounting; business knowledge; gathering informing; people management,53.2
be btech,mechanical engineering,technology,analytical thinking; negotiation; team work,77
be btech,mechanical engineering,data analytics; data science; financial analysis,active listening; analytical thinking; artificial intelligence; business knowledge; data visualization; java; machine learning; product knowledge; programming language skills; python; sql,62.13
bcom,information technology,technology,communication; computer hardware; excel; l3 printer; leadership; microsoft windows; negotiation; networking,58
bcom,accounting and finance,data analytics; financial analysis; sales and marketing,accounting; active listening; business knowledge; client management; data visualization; editing; gathering information; leadership; people management; problem solving; sql,75.05
be btech,electrical and electronics engineering,government job; information technology; service; technology; web development,communication; java; problem solving; programming language skills; sql,64.6
mba,human resources,digital marketing; market research; public speaking; research; sales and marketing; teaching; technology; trading,active listening; analytical thinking; hardware; human resources; people management; programming language skills,78.75
be btech,electronics and communication engineering,blockchain; design; digital marketing; industry; web design,critical thinking; leadership; machine learning; matlab; programming language skills,75
be btech,civil engineering,data analytics,analytical thinking; creativity skills; excel; presentation; programming; teamwork,73.15
be btech,electronics and communication engineering,content writing; digital marketing; gaming; market research,active listening; critical thinking; problem solving; teaching; writing,65.455
be btech,electronics and communication engineering,data analytics,c; javascript; python,76
be btech,mathematics,data analytics,programming language skills,71
be btech,mechanical engineering,financial analysis,critical thinking; negotiation; writing,69.35
be btech,mechanical engineering,product analysis; research,critical thinking; designing skills; excel; logical thinking; presentation; problem solving; product knowledge; work under pressure,74.7
be btech,data science,data analytics; data science; information technology; technology; trading,data visualization; leadership; python; sql,66.5
bcom,commerce,data analytics; financial analysis,accounting; active listening; data visualization; designing skills; editing; hardware; mass communication; problem solving; programming language skills; risk management skills; writing,89
be btech,mathematics,technology; trading,accounting; artistic skills; communication; designing skills; problem solving; python; sales; team work; writing,66.5
be btech,civil engineering,gaming,editing,66.5
be btech,electrical and electronics engineering,data analytics,analytical thinking; editing; matlab; python,63.49
be btech,automobile engineering,entrepreneurship; financial analysis; technology,communication; team work,71.25
ba,economics,data analytics; web design; web development,analytical thinking; communication; programming language skills; python,61.08
be btech,electrical and electronics engineering,teaching,problem solving,67.45
be btech,electrical and electronics engineering,data science; financial analysis; research; teaching; technology,active listening; c; communication; creativity skills; excel; interpersonal skills; leadership; logical thinking; mass communication; observation skills; people management; presentation; problem solving; programming; python; r; reading; reporting; risk managing; sql; subject knowledge; team work; wealth management; work under pressure; writing,70.585
bcom,commerce,entrepreneurship; financial analysis; human behavior; research; sales and marketing; teaching; technology; trading,accounting; active listening; artistic skills; business knowledge; communication; cost accounting; designing skills; editing; excel; interpersonal skills; leadership; people management; problem solving; programming; reading; sales; subject knowledge; team work; wealth management; writing,75
be btech,computer science engineering,technology,java; programming language skills,50
bsc,computer science engineering,technology,teaching,68.685
be btech,biotechnology,biotechnology; human biology; research,agarose gel electrophoresis; imagej and zen2012 softwares; immunochemistry immunocytochemistry; paper chromatography; sds page; thin layer chromatography tlc,84.455
ba,home science,content writing; gardening; government job; human behavior; infrastructure; interior design; research; social causes; social justice,active listening; analytical thinking; c; communication; content creation; critical thinking; editing; gathering information; leadership; people management; presentation; problem solving; programming language skills; risk management skills; writing,75.05
ma,english econamics,teaching,teaching,60
be btech,mechanical engineering,data analytics; gaming; research; technology; trading,active listening; analytical thinking; business knowledge; communication; critical thinking; data visualization; interpersonal skills; machine learning; negotiation; problem solving; programming language skills; python; sql,83.315
bca,programming,data analytics; data science; excel; information technology; machine learning; research; retail; supply chain; technology; trading; web design; web development,active listening; analytical thinking; c; cloud computing; critical thinking; gathering information; java; javascript; php; problem solving; product knowledge; programming language skills; python; sql,72.01
be btech,electrical engineering,data science,analytical thinking; communication; critical thinking; programming language skills; sql,67.94
bsc,mathematics,data science,analytical thinking; artificial intelligence; critical thinking; gathering information; python; sql,53
be btech,information technalogy,content writing,interpersonal skills; presentation; team work; work under pressure; writing,77.33
bba,management,entrepreneurship; financial analysis; human behavior; journalism,accounting; business knowledge; communication; critical thinking; excel; interpersonal skills; leadership; logical thinking; presentation; problem solving; reading; work under pressure; writing,71.25
bcom,commerce,financial analysis,accounting; active listening,60
ba,economics,data analytics; data science; financial analysis; research,analytical thinking; business knowledge; communication; critical thinking; data visualization; excel; problem solving,76
bcom,business administration,content writing; data analytics; gaming; human behavior; journalism; research; trading,accounting; active listening; analytical thinking; artistic creative skills; business knowledge; critical thinking; gathering information; hospitality; human resources; leadership; people management,89.3
be btech,computer science engineering,journalism; teaching; technology,java; wealth management,66
be btech,electronics and communication engineering,technology; vlsi,core skills; programming,69.35
be btech,electrical and electronics engineering,higher studies,no,80.75
bsc,computer science engineering,data analytics; data science; technology,analytical thinking; c; communication; java; leadership; machine learning; problem solving; programming language skills; python; sql,51
be btech,computer science engineering,information technology; service; social causes; teaching; technology,accounting; communication; critical thinking; java; people management,76
be btech,mechanical engineering,technology,communication; sql; team work,76
be btech,civil engineering,human resources,java; python; sql,77.995
be btech,mechanical engineering,industry; technology,cad cae autocad catia ansys proe seimensnx,70.3
bcom,accounting and finance,financial analysis,accounting,57
be btech,computer science engineering,data science; machine learning,c; data structures; database management system dbms; digital marketing; mysql; programming; python,70.87
bsc,computer science,data science,gathering information,60
bsc,computer science engineering,data analytics; data science; web design,communication; critical thinking; gathering information; python,65
be btech,electronics and telecommunication engineering,cloud computing; cyber security; data analytics; machine learning; technology,active directory; cisco asa; cisco security; crowdstrike; cyber security; cyber threat intelligence cti; cybersecurity incident response; information security; itil; mcafee antivirus; microsoft operating systems; network security; server administration; shavlikarcsight; sumologic,81.7
be btech,automobile engineering,racing; technology,critical thinking; leadership; observation skills; people management; team work; work under pressure,67.45
be btech,mechanical engineering,research; teaching,analytical thinking; cad cae autocad catia ansys proe seimensnx,72
ba,english,government job,artistic creative skills,63.65
bsc,mathematics,data analytics; data science; digital marketing; government job; information technology; machine learning; research; web design; web development,accounting; active listening; analytical thinking; artistic creative skills; business knowledge; c; communication; critical thinking; data visualization; editing; gathering information; leadership; machine learning; presentation; problem solving; programming language skills; python; r; risk management skills,79
bca,programming,government job,writing,75
be btech,civil engineering,data analytics; data science; gaming; infrastructure; interior design; teaching; technology; web design; web development,analytical thinking; artificial intelligence; artistic creative skills; communication; content creation; critical thinking; data visualization; designing skills; editing; gathering information; leadership; machine learning; matlab; presentation; problem solving; product knowledge; programming language skills; python; risk management skills; sql; writing,76.095
be btech,electronics and communication engineering,technology,no,76
be btech,electrical and electronics engineering,software development,no,66.5
be btech,electrical and electronics engineering,software development,no,66.5
be btech,automobile engineering,social justice,team work,81.7
bsc,physics,teaching,writing,75.05
be btech,mathematics,financial analysis; human behavior; human biology; teaching; trading,excel; presentation; problem solving; writing,57.95
mba,marketing,sales and marketing; social justice,leadership; product knowledge,87.4
diploma,nan coal,industry,risk management skills; sap,69
be btech,electronics and communication engineering,data analytics,analytical thinking; problem solving; python; sql,68.4
mtech,electrical and electronics engineering,journalism; research; social justice; teaching; technology,active listening; business knowledge; critical thinking; hardware,77
be btech,electronics and communication engineering,industry; teaching; technology,assembly language; battery management systems; electronic circuit design; electronics hardware; electronics hardware design; embedded systems; graphic design; iot; mechatronics; microcontrollers; pcb design; product development; robotics; system deployment,68.4
mtech,civil engineering,data analytics; financial analysis; research; web development,analytical thinking; business knowledge; etabs; proeficiency in software like staad pro,72
be btech,mechanical engineering,entrepreneurship; research,active listening; business knowledge; interpersonal skills; team work; work under pressure; writing,90
be btech,electrical and electronics engineering,technology,java; programming,80
be btech,data science,entrepreneurship; financial analysis; research; sales and marketing; technology,analytical thinking; business knowledge; communication; creativity skills; critical thinking; excel; gathering informing; interpersonal skills; leadership; linux; mass communication; negotiation; observation skills; people management; presentation; product knowledge; programming; python; reading; risk managing; sql; subject knowledge; tableau; wealth management; work under pressure,71.25
be btech,computer science engineering,technology,no,66.5
mdcs,information technalogy,financial analysis,analytical thinking; building rapport; linux; oracle; programming; sql; subject knowledge; team work,75
be btech,civil engineering,data analytics,communication; critical thinking; gathering information; machine learning; python; writing,70
bcom,m com management and marketing,digital marketing; financial analysis; government job; sales and marketing,business knowledge; communication; critical thinking; gathering information; leadership; mass communication; negotiation; people management; problem solving; risk management skills; sales; social media marketing,65
be btech,electronics and communication engineering,human behavior; human biology,communication; creativity skills; interpersonal skills; leadership; negotiation; people management; presentation; team work,70
bcom,commerce,financial analysis; research; social causes,accounting; wealth management,69.35
bba,business administration,human resources,human resources,74.1
be btech,computer science engineering,data analytics; data science; government job; web design,data visualization; programming language skills; python; sql,62.415
be btech,computer science engineering,research; technology,java; programming; sql,73.15
be btech,computer science engineering,content writing; data analytics; data science; digital marketing; financial analysis; government job; human behavior; industry; infrastructure; journalism; navy defence related; product lifecycle management; retail; sales and marketing; social media marketing; supply chain,active listening; analytical thinking; business knowledge; communication; critical thinking; hospitality; human resources; interpersonal skills; leadership; machine learning; presentation; problem solving; programming language skills; python; risk management skills; social media marketing; sql; writing,60
bca,mathematics,gaming,communication,75
bcom,accounting and finance,financial analysis; sales and marketing,accounting; active listening; business knowledge; communication; leadership; reading; sales; team work; writing,58.14
bcom,commerce,entrepreneurship,interpersonal skills; leadership; product knowledge; sales,87
bcom,statistics,analysis; technology,excel; machine learning; problem solving; programming; python; sql; tableau,71.25
be btech,electrical and electronics engineering,industry; technology,dc drives; dc to ac converters; dc to dc converters; facts devices; keil; kicad; matlab; power systems,76
be btech,electrical and electronics engineering,data analytics,no,65.55
be btech,mechanical engineering,data analytics; data science; financial analysis; government job; human behavior; information technology; navy defence related; research; sports industry; technology,analytical thinking; data visualization; leadership; machine learning; people management; product knowledge; python; sql,63
bcom,business administration,sales and marketing,business knowledge,76
ba,general,information technology; interior design; social justice,civil criminal law; communication; finance related skills; negotiation,66
bsc,biotechnology,teaching; technology,building rapport; gathering informing; interpersonal skills; subject knowledge,74.1
bsc,agriculture,sales and marketing; supply chain,active listening; communication; gathering information; mass communication,70.3
bhmct,hospitality,financial analysis; human behavior; research; technology,active listening; analytical thinking; artistic skills; communication; critical thinking; excel; gathering informing; python; work under pressure,74.1
be btech,chemical engineering,financial analysis; human behavior; journalism; research; social justice; teaching; technology,active listening; analytical thinking; artistic skills; business knowledge; communication; creativity skills; critical thinking; designing skills; editing; excel; gathering informing; interpersonal skills; java; leadership; machine learning; mass communication; news gathering; oracle; people management; presentation; problem solving; product knowledge; programming; python; risk managing; sql; wealth management; work under pressure; writing,71.25
bms,marketing,teaching,reading; sales,75.05
ba,sociology,data analytics; gaming; technology; web design,data visualization; hardware; programming language skills; python; r; sql,69
ba,sociology,technology,excel; machine learning; python; r; sql; tableau,65.55
arts,literature,research; teaching,communication; critical thinking; leadership; team work; writing,66.5
bca,computer science,technology; web design,designing skills; java,76.855
be btech,electronics and communication engineering,data science,python; r,71.25
be btech,mechanical engineering,journalism,communication; excel; leadership; problem solving; reading; team work; work under pressure,70.3
be btech,computer science engineering,data analytics; data science; research; technology,aws; business knowledge; c; cloud computing; communication; data visualization; designing skills; interpersonal skills; leadership; machine learning; presentation; python; r; sql,69
mba,bba,interior design; market research; sales and marketing; social justice; social media marketing,active listening; business knowledge; communication; hardware; hospitality; mass communication; negotiation; problem solving; sales; social media marketing,66.5
be btech,mathematics,data analytics; industry; market research; product lifecycle management; sports industry,business knowledge; human resources; leadership; problem solving; product knowledge; risk management skills; sales,70
bba,statistics,financial analysis,analytical thinking; business knowledge; communication; data visualization; leadership; machine learning; negotiation; people management; problem solving; python; sql; wealth management,71
be btech,design,design,designing skills,68
be btech,mechanical engineering,data analytics,analytical thinking,72.2
be btech,mechanical engineering,human behavior; research; supply chain; technology; trading,active listening; communication; critical thinking; data visualization; hardware; leadership; machine learning; presentation; problem solving; python; risk management skills; sql; writing,77.07
be btech,electrical and electronics engineering,teaching,active listening; interpersonal skills; presentation; reading; teamwork; work under pressure,67.45
be btech,mechanical engineering,design,etabs; proeficiency in software like staad pro,68.4
